{"schemaVersion":1,"releaseId":1,"generatedAt":"2026-08-15T00:00:00.000Z","site":{"name":"长安休息室","authorBio":"后端工程师，记录系统、代码与长期主义。","aboutMarkdown":"## 关于我\n\n这里是我的技术笔记。","filingName":"长安休息室","filingNumber":"浙ICP备17057726号-1","socialLinks":[{"label":"GitHub","url":"https://github.com/qiuxs"}]},"tags":[{"id":1,"name":"Go","slug":"go"},{"id":2,"name":"工程实践","slug":"engineering"}],"articles":[{"articleId":1,"revisionId":1,"slug":"building-reliable-services","title":"构建可靠的服务","summary":"从边界、契约与可观测性开始。","contentMarkdown":"# 构建可靠的服务\n\n可靠性来自清晰的边界。\n\n- 明确契约\n- 保持可观测\n\n```go\nfunc main() { println(\"hello\") }\n```","contentHash":"sha256:0000000000000000000000000000000000000000000000000000000000000000","publishedAt":"2026-08-14T08:00:00.000Z","tags":["go","engineering"]}],"checksum":"sha256:d68cc72bdc196ff49576d24b8f22efde8d4f739df602e6c86cb58260927c1d0f"}
